"File Name","Title","Text","First Words","Last Words"
"Καραλής_ «Έχω αντιμετωπίσει ρατσισμό και κατάθλιψη» - ΤΑ ΝΕΑ.html","Καραλής: «Έχω αντιμετωπίσει ρατσισμό και κατάθλιψη»","Λίγο πριν ξεκινήσει την αγωνιστική του δράση για το 2025, ο Εμμανουήλ Καραλής έδωσε συνέντευξη εφ’ όλης της ύλης στην Παγκόσμια ομοσπονδία στίβου που έχει τίτλο: «Το νεότερο μέλος του κλαμπ των έξι μέτρων, ο Καραλής συνεχίζει να ξεπερνά εμπόδια». Ο χάλκινος Ολυμπιονίκης στο άλμα επι κοντώ, μίλησε για το μετάλλιο στο Παρίσι, το «φράγμα» των έξι μέτρων, τη μάχη με την κατάθλιψη, τον ρατσισμό και αποκάλυψε τα σχέδια του για το μέλλον. Η συνέντευξη ξεκίνησε με το μετάλλιο στους Ολυμπιακούς Αγώνες και τα έξι μέτρα.  «Φυσικά το να πάρω ένα Ολυμπιακό μετάλλιο σε ηλικία 24 ετών είναι κάτι μεγάλο, αλλά το μεγαλύτερο ορόσημό μου είναι το άλμα πάνω από 6 μέτρα. Είναι κάτι που πάντα ονειρευόμουν. Το έκανα και τώρα νιώθω πιο σίγουρος από ποτέ. Νιώθω ότι μπορώ να αρχίσω να σκέφτομαι υψηλότερες επιδόσεις». Για τον κάτοχο του παγκοσμίου ρεκόρ και φίλο του Μόντο Ντουπλάντις, ο Καραλής είπε: «Είμαι στην ίδια ηλικία με τον Μόντο, οπότε ελπίζω να συνεχίσουμε μαζί. Ο Μόντο θα κάνει ό,τι κάνει και ελπίζω να αρχίσω να τον πλησιάζω. Είναι ένα μεγάλο κίνητρο, έχοντας τον Μόντο φίλο και συναγωνιστή, να βρισκόμαστε στους αγώνες μαζί κάθε εβδομάδα. Αυτό είναι πολύ σημαντικό για τον στίβο και για το επί κοντώ». Το είδωλο του Καραλή πάντως είναι ο Ουκρανός Σεργκέι Μπούμπκα: «Όταν ήμουν μικρός ο Σεργκέι ήταν ένα από τα μεγαλύτερα είδωλα μου. Στο Κάλι (σ.σ. Παγκόσμιο πρωτάθλημα Κ18), μου έδωσε το πρώτο μου μετάλλιο, δίπλα στον Μόντο. Στους Ολυμπιακούς Αγώνες στο Παρίσι έκανε το ίδιο με τα ίδια μετάλλια, εγώ πήρα χάλκινο και ο Μόντο πήρε το χρυσό. Είναι κάτι σπουδαίο. Λέει ότι είμαι πολύ καλός αθλητής του επί κοντώ και όταν το λέει ο συγκεκριμένος, είναι κάτι εκπληκτικό». Ο 25χρονος άλτης μίλησε για το ρατσισμό και την κατάθλιψη. «Έχω αντιμετωπίσει τον ρατσισμό και την κατάθλιψη. Είχα ένα ή δύο χρόνια που δεν μπορούσα να αποδώσω όσο καλά ήθελα, αλλά πίστευα στον εαυτό μου και είχα ένα σύστημα υποστήριξης γύρω μου. Έχω την οικογένεια μου και άλλους ανθρώπους γύρω μου που με υποστηρίζουν τους ατζέντηδες μου, τους προπονητές μου και τους συναθλητές μου. Με βοήθησαν να ξεπεράσω όλα αυτά τα προβλήματα και μερικές φορές χρειάζεται να χαλαρώσεις και να σκεφτείς τη ζωή γενικά. Ήμουν πιο πεινασμένος από ποτέ για να επιστρέψω και να αγωνιστώ στο υψηλότερο επίπεδο. Είμαι πολύ τυχερός που έχω την οικογένειά μου κοντά μου». Ιδιαίτερη αναφορά έγινε στην οικογένεια του αλλά και στο προπονητικό τιμ που τον πλαισιώνει: «Ο μπαμπάς μου είναι ο πυρήνας και ο μαέστρος. Προπονούμαι καθημερινά με τον Μίλτο (σ.σ. Τεντόγλου) για την τεχνική μου στο τρέξιμο, τα βάρη και την εκρηκτικότητα. Ο μπαμπάς μου κάνει τη φυσική προετοιμασία για να φτιάξω το σώμα μου σωστά μέχρι να έρθει η ώρα να πάω στην Πολωνία, όπου προπονούμαι μαζί με τον Λίσεκ. Είναι διασκεδαστικό να προπονούμαι με άλλους αθλητές στο ίδιο επίπεδο και μου αρέσει να βρίσκομαι στην Ελλάδα και μετά να πηγαίνω στην Πολωνία σε προπονητικά καμπ. Αυτό το προπονητικό μοντέλο μού βγήκε πολύ καλά. Ο μπαμπάς μου, φυσικά, είναι ο συντονιστής όλης αυτής της ομάδας», λέει ο Καραλής. Για την εξέλιξη του αγωνίσματος του, είπε: «Το επί κοντώ αλλάζει και νομίζω ότι βρισκόμαστε στη χρυσή εποχή. Το να έχεις έναν αθλητή σαν τον Μόντο να κάνει μαγικά πράγματα είναι σπουδαίο. Ακόμα κι αν ο Μόντο δεν ήταν ο κάτοχος του παγκόσμιου ρεκόρ, έχουμε πολλούς αθλητές που πηδούν 5,90 μέτρα και 6,00 μ. τώρα. Στο μέλλον σίγουρα θα δούμε εκπληκτικά πράγματα. Πιστεύω πραγματικά ότι μπορώ να είμαι συνεπής σε άλματα στα 6 μ. και ανυπομονώ για το μέλλον». Όταν ρωτήθηκε για το εάν έχει αλλάξει η καθημερινότητα του μετά τις επιτυχίες που σημείωσε το 2024, ο Εμμανουήλ Καραλής απάντησε: «Στην Αθήνα όπου κι αν πάω τώρα είμαι αναγνωρίσιμος. Είναι κάτι καινούργιο για μένα. Πριν, ο κόσμος με ήξερε, είχα κάνει πανελλήνια ρεκόρ και είχα μερικά μετάλλια, αλλά τώρα μετά το χάλκινο Ολυμπιακό και μετά τα 6 μέτρα, είναι κάτι πολύ μεγάλο». Όσο για τι σκέφτεται να κάνει όταν τελειώσει το κεφάλαιο του πρωταθλητισμού τόνισε: «Θέλω να φτιάξω έναν αθλητικό σύλλογο και να βοηθήσω τους νέους που ξεκινούν το άθλημα του επί κοντώ. Τώρα δεν είναι η ώρα γιατί πρέπει να επικεντρωθώ σε αυτά που θέλω να πετύχω, αλλά σίγουρα θέλω να κάνω κάτι για να βοηθήσω τις νεότερες γενιές στην Ελλάδα να ασχοληθούν με το επί κοντώ».","Λίγο πριν ξεκινήσει την αγωνιστική του δράση για το 2025, ο Εμμανουήλ Καραλής έδωσε συνέντευξη εφ’ όλης της ύλης στην Παγκόσμια ομοσπονδία στίβου που έχει τίτλο: «Το νεότερο μέλος του κλαμπ των έξι μέτρων, ο Καραλής συνεχίζει να ξεπερνά εμπόδια». Ο χάλκινος Ολυμπιονίκης στο άλμα επι κοντώ, μίλησε για το μετάλλιο στο Παρίσι, το «φράγμα» των έξι μέτρων, τη μάχη με την κατάθλιψη, τον ρατσισμό και αποκάλυψε τα σχέδια του για το μέλλον. Η συνέντευξη ξεκίνησε με το μετάλλιο στους Ολυμπιακούς Αγώνες και τα έξι μέτρα. «Φυσικά το να πάρω ένα Ολυμπιακό μετάλλιο σε ηλικία 24 ετών είναι κάτι μεγάλο,","αναγνωρίσιμος. Είναι κάτι καινούργιο για μένα. Πριν, ο κόσμος με ήξερε, είχα κάνει πανελλήνια ρεκόρ και είχα μερικά μετάλλια, αλλά τώρα μετά το χάλκινο Ολυμπιακό και μετά τα 6 μέτρα, είναι κάτι πολύ μεγάλο». Όσο για τι σκέφτεται να κάνει όταν τελειώσει το κεφάλαιο του πρωταθλητισμού τόνισε: «Θέλω να φτιάξω έναν αθλητικό σύλλογο και να βοηθήσω τους νέους που ξεκινούν το άθλημα του επί κοντώ. Τώρα δεν είναι η ώρα γιατί πρέπει να επικεντρωθώ σε αυτά που θέλω να πετύχω, αλλά σίγουρα θέλω να κάνω κάτι για να βοηθήσω τις νεότερες γενιές στην Ελλάδα να ασχοληθούν με το επί κοντώ»."
"Οι αόρατοι Αφροέλληνες που «μεγαλώνουν» την Ελλάδα μας - ΤΑ ΝΕΑ.html","Οι αόρατοι Αφροέλληνες που «μεγαλώνουν» την Ελλάδα μας","Ηιστορία και το success story του Γιάννη Αντετονκούνμπο και της οικογένειάς του στο NBA άγγιξε και συγκίνησε τους έλληνες συμπατριώτες του. Ωστόσο η πραγματικότητα δεν κυλά πάντα ομαλά και για τους υπόλοιπους Αφροέλληνες. «Αφροέλληνες θα πει: έχω ρίζες από την Αφρική, αλλά είμαι γεννημένος εδώ». Οπου «εδώ» είναι Ελλάδα και η περιοχή της Φωκίωνος Νέγρη στην Κυψέλη, μπροστά από το γλυπτό σιντριβάνι της οποίας ο νεαρός κάτοικος μιλάει στον φακό του σκηνοθέτη Μενέλαου Καραμαγγιώλη στο πλαίσιο της ταινίας του «Afro-Greeks». Ο τίτλος της ταινίας είναι μια δημόσια δήλωση και παραδοχή του δικαιώματός τους να ονομάζονται Αφροέλληνες. «H ταινία έχει πρωταγωνιστές μετανάστες από την Αφρική στην Ελλάδα που ζουν αόρατοι και προσπαθούν να ενσωματωθούν στην ελληνική κοινωνία. Η ταινία αυτή ξεκίνησε το 2015 με στόχο να αποκτήσουν όνομα και φωνή οι “αόρατοι” της Κυψέλης, στην Αθήνα, που διεκδικούν το δικαίωμα να είναι Ελληνες με αφρικανική καταγωγή. Καθώς ζούσα στην Κυψέλη είχα παρατηρήσει ότι η αφρικανική κοινότητα αναζητούσε αφορμές συνεύρεσης για να κάνουν κάτι. Από το αυτονόητο, να ντυθούν με τα καλά τους και να χορέψουν ή να συναντηθούν για να μιλήσουν για τα προβλήματά τους και να βρουν λύση μεταξύ τους. Είχα παρακολουθήσει τις συναντήσεις τους στην καθολική εκκλησία της Κυψέλης και από αυτή την πραγματικότητα που έβλεπα μπροστά μου θέλησα να δημιουργήσω κάποιες δυνατότητες να εμφανιστούν και παραέξω. Τότε, το 2015, κανείς δεν χρηματοδοτούσε εύκολα μία τέτοια ιδέα» εξηγεί στα «ΝΕΑ» ο σκηνοθέτης. Ο ίδιος επισημαίνει ότι η πρώτη φορά που ακούστηκε δημόσια η λέξη Αφροέλληνες ήταν το 2011 σε τραγούδι του MC Yinka (Μανώλης Αφολάνιο). Και η δεύτερη, το 2018, στην Δημοτική Αγορά της Κυψέλης, στο πλαίσιο της σειράς ανοιχτών συζητήσεων Athens Dialogues σε οργάνωση του Ιδρύματος Σταύρος Νιάρχος, όταν προβλήθηκε ένα πρώτο βίντεο από τους «Afro-Greeks» του Καραμαγγιώλη. Σε επόμενη μορφή του παρουσιάστηκε ως εγκατάσταση στον χώρο της Κυψέλης We Need Books , όπου γίνονται μαθήματα ελληνικών και λειτουργεί βιβλιοθήκη για μετανάστες. Καθώς και στην καθολική εκκλησία Κυψέλης. Η ταινία «Afro-Greeks» από τότε έχει εξελιχθεί σε μία ανοιχτή διαδικασία καλλιτεχνικού εγχειρήματος που ακολουθεί και καταγράφει την αφρικανική κοινότητα της Αθήνας. Το έργο «AfroGreeks» κινηματογραφείται εδώ και 5 χρόνια από τον Μενέλαο Καραμαγγιώλη και την ομάδα Døcumatism με στόχο να εκτεθεί ως βιντεοεγκατάσταση που θα περιέχει ζωντανές εκδηλώσεις με αφροέλληνες καλλιτέχνες. Μέχρι σήμερα οι 120 αφροέλληνες που πρωταγωνιστούν στα βίντεο της εγκατάστασης του έργου ζουν και δουλεύουν στην Αθήνα, διεκδικούν το δικαίωµα να είναι καλλιτέχνες και πασχίζουν µε κάθε τρόπο να εκφραστούν. Οπως ο Μίκελ και η Πέγκυ που βιοπορίζονται, εκείνος ως διανομέας , εκείνη ως κομμώτρια, διεκδικώντας ωστόσο το δικαίωμα να είναι έλληνες καλλιτέχνες. Και ο Ελληνονιγηριανός Νίκος Οντουμπιτάν, από την ΜΚΟ Generation 2.0, η οποία βοηθά παιδιά δεύτερης γενιάς μεταναστών στην Ελλάδα.  Ομάδα δράσης. Μέσα από αυτήν την ομάδα των πρωταγωνιστών του «Afro-Greeks» δημιουργήθηκε και μία ομάδα δράσης που καθοδηγεί τα άλλα μέλη της κοινότητας βρίσκοντας λύσεις για να σπάσει το περιθώριο και η απομόνωσή τους καθώς βρίσκουν δίαυλο επικοινωνίας στα social media και το hashtag #TheAfroGreeks. Παράλληλα γίνεται διερεύνηση της έννοιας Αφροέλληνες, ανοίγοντας μεταξύ τους συζήτηση για τις συνθήκες με τις οποίες ορίζουν οι ίδιοι τους εαυτούς τους ως Αφροέλληνες: ως παιδιά μεταναστών που γεννήθηκαν στην Ελλάδα, ως μέλη οικογενειών που έζησαν στην Ελλάδα και τώρα διαμένουν σε άλλη ευρωπαϊκή χώρα. Ο Νίκος Οντουμπιτάν σχολιάζει σε δημοσίευμα της γαλλικής «Le Monde» πως θα ήθελε η δημοσιοποίηση της καριέρας του Γιάννη Αντετονκούνμπο από τα ΜΜΕ να ανοίξει επιτέλους τη συζήτηση στην Ελλάδα για τους Αφροέλληνες, για αυτά τα παιδιά χωρίς ελληνική εθνικότητα που μεγαλώνουν στη χώρα και για την ανάγκη κοινωνικής ενσωμάτωσής τους. «Ολοι αυτοί οι νέοι που σπουδάζουν για να γίνουν γιατροί, δικηγόροι, μηχανικοί και που υπερβαίνουν τα εμπόδια σε μια χώρα της οποίας η προτεραιότητα δεν είναι η κοινωνική ένταξη αξίζουν να αναδειχθούν» τονίζει ο Νίκος Οντουμπιτάν.","Ηιστορία και το success story του Γιάννη Αντετονκούνμπο και της οικογένειάς του στο NBA άγγιξε και συγκίνησε τους έλληνες συμπατριώτες του. Ωστόσο η πραγματικότητα δεν κυλά πάντα ομαλά και για τους υπόλοιπους Αφροέλληνες. «Αφροέλληνες θα πει: έχω ρίζες από την Αφρική, αλλά είμαι γεννημένος εδώ». Οπου «εδώ» είναι Ελλάδα και η περιοχή της Φωκίωνος Νέγρη στην Κυψέλη, μπροστά από το γλυπτό σιντριβάνι της οποίας ο νεαρός κάτοικος μιλάει στον φακό του σκηνοθέτη Μενέλαου Καραμαγγιώλη στο πλαίσιο της ταινίας του «Afro-Greeks». Ο τίτλος της ταινίας είναι μια δημόσια δήλωση και παραδοχή του δικαιώματός τους να ονομάζονται Αφροέλληνες. «H ταινία έχει πρωταγωνιστές","μέλη οικογενειών που έζησαν στην Ελλάδα και τώρα διαμένουν σε άλλη ευρωπαϊκή χώρα. Ο Νίκος Οντουμπιτάν σχολιάζει σε δημοσίευμα της γαλλικής «Le Monde» πως θα ήθελε η δημοσιοποίηση της καριέρας του Γιάννη Αντετονκούνμπο από τα ΜΜΕ να ανοίξει επιτέλους τη συζήτηση στην Ελλάδα για τους Αφροέλληνες, για αυτά τα παιδιά χωρίς ελληνική εθνικότητα που μεγαλώνουν στη χώρα και για την ανάγκη κοινωνικής ενσωμάτωσής τους. «Ολοι αυτοί οι νέοι που σπουδάζουν για να γίνουν γιατροί, δικηγόροι, μηχανικοί και που υπερβαίνουν τα εμπόδια σε μια χώρα της οποίας η προτεραιότητα δεν είναι η κοινωνική ένταξη αξίζουν να αναδειχθούν» τονίζει ο Νίκος Οντουμπιτάν."
