File Name,Title,Text,First Words,Last Words,Sentiment,Sentiment Score,Racial_Hate_Speech,Explanation_Hate_Speech,Motivation_Author,Explanation_Motivation,newspaper,Country
"Internet e haters, _sui social in Italia messaggi razzisti e insulti sessisti, da Kyenge a Boldrini_ - Il Fatto Quotidiano.html","Internet e haters, “sui social in Italia messaggi razzisti e insulti sessisti, da Kyenge a Boldrini”","Messaggi di odio che corrono in rete e fanno da cassa di risonanza al dibattito pubblico , sempre più carico di contenuti xenofobi e razzisti . Su social , blog e siti internet (come nella vita reale) si attaccano le minoranze , mentre i politici si fanno la guerra. A volte carnefici , a volte vittime . Come nel caso dell’ex ministro Kyenge definita ‘scimmia congolese’ sui siti dai contenuti razzisti , insultata (fuori e dentro la rete) da diversi politici . Che spesso correggono il tiro, ma quasi mai pagano. In occasione della Giornata internazionale per l’eliminazione della discriminazione razziale Arci , insieme a Cittalia , avvia la campagna del progetto Prism (Prevenire, modificare e inibire i discorsi d’odio sui nuovi media) che coinvolge diversi Paesi europei . Il fenomeno è stato analizzato in una ricerca contenuta nel volume ‘ Discorsi d’odio e social media ’: al vaglio l’uso del linguaggio offensivo nei nuovi media da parte di gruppi xenofobi e di estrema destra e i possibili strumenti per contrastarlo. In primis quelli legislativi che, in Italia , restano ancora insufficienti. Dal caso Kyenge a quello Boldrini – Il rapporto della Commissione europea contro il razzismo e l’intolleranza del 2012 evidenzia che in Italia i contenuti xenofobi sempre più presenti nel dibattito politico trovano terreno fertile nella crisi economica e nella gestione dell’immigrazione. Eppure “il discorso razzista – rivela la ricerca – travalica l’ambito della destra radicale , coinvolgendo intellettuali e massimi esponenti delle istituzioni ”. Che si fanno frequentemente autori, per lo più impuniti, di messaggi di intolleranza sempre più spesso via social network. Come nel caso dell’ex ministra per l’integrazione Cécile Kyenge , vittima degli attacchi sessisti e razzisti di esponenti di Forza Nuova e Lega Nord , in primis il senatore leghista Roberto Calderoli , poi ‘assolto’ dalla giunta per le immunità del Senato , anche grazie ai voti dei parlamentari del Pd , lo stesso partito della Kyenge . Solo sessisti, invece, gli insulti alla presidente della Camera, Laura Boldrini , pubblicati come commenti (poi cancellati dallo staff M5s ) a un post su Facebook di Beppe Grillo , che chiedeva provocatoriamente agli utenti “Cosa succederebbe se ti trovassi la Boldrini in macchina?”. “La rete è una grande opportunità, uno spazio bellissimo, non può essere usata in questo modo violento” disse la presidente di Montecitorio . In un anno 700 episodi di razzismo sui social – Secondo i dati dell’ Ocse , nel 2013 le forze dell’ordine hanno registrato 472 casi di crimini d’odio : il 48% discriminazioni religiose, il 41% razzismo e xenofobia , l’11% insulti contro persone Lgbt . Stando ai dati dell’Ufficio anti-discriminazioni razziali, nel 2013 per la prima volta i casi online hanno superato quelli registrati nella vita pubblica: 354 episodi nei media, la maggior parte sui social . Un fenomeno in crescita: nel 2014 l’ Unar ha registrato 347 espressioni razziste sui social network, di cui 185 (oltre il 50%) su Facebook . A cui vanno aggiunte altre 326 nei link che le rilanciano, per un totale di quasi 700 episodi di intolleranza . L’ Osservatorio per la sicurezza contro gli atti discriminatori del Viminale , dal 2011 al 2014 ha ricevuto 150 segnalazioni su siti e profili internet con contenuti discriminatori e di incitamento all’odio (il 23% delle segnalazioni totali). Il ruolo dei partiti – Lo studio ha analizzato l’utilizzo della rete da parte di partiti e associazioni . Sotto osservazione Lega Nord , Casapound (oggi alleato della Lega), Forza Nuova , il sito di controinformazione Resistenza nazionale , losai.eu e Radio Spada . È il Carroccio , più di tutti, ad aver fatto propria la spinta ideologica populista e xenofoba diffusasi in Europa : “Da partito secessionista del Nord Italia ha attuato una svolta nazionalista, attirando anche elettori di CasaPound e Forza Nuova ”. Ogni gruppo costruisce la propria retorica su determinate questioni: “L’attenzione ai temi sociali degli ‘italiani’ nel caso di CasaPound e Forza Nuova ; l’insistenza xenofoba su migranti e rom per Lega Nord e Resistenza Nazionale (quest’ultima in chiave più criminalizzante); il proselitismo religioso per il network cattolico”. Eppure l’incitamento all’odio si diffonde più attraverso parole chiave della retorica populista (popolo, italiani, immigrati), che su quelle radicali (si arriva al massimo all’hashtag #stopinvasione ), probabilmente per evitare sanzioni penali. La normativa – In Italia c’è poca consapevolezza del fenomeno. Nei giorni successivi al naufragio del 19 aprile 2015 nel Canale di Sicilia (in cui hanno perso la vita quasi mille migranti ), sono stati pubblicati commenti razzisti per nulla anonimi. Spesso, infatti, chi scrive non percepisce come illeciti i contenuti che pubblica e, quindi, non nasconde la propria identità . Sotto il profilo legislativo la legge Mancino (pur prevedendo pene più severe rispetto alla legge 85 del 2006) è antecedente alla diffusione dell’uso di internet e prevede solo quattro reati punibili (quelli discriminatori basati sull’etnia, la nazionalità, la religione e le minoranze linguistiche). Il risultato? Non tutta la propaganda razzista è sanzionabile penalmente.","Messaggi di odio che corrono in rete e fanno da cassa di risonanza al dibattito pubblico , sempre più carico di contenuti xenofobi e razzisti . Su social , blog e siti internet (come nella vita reale) si attaccano le minoranze , mentre i politici si fanno la guerra. A volte carnefici , a volte vittime . Come nel caso dell’ex ministro Kyenge definita ‘scimmia congolese’ sui siti dai contenuti razzisti , insultata (fuori e dentro la rete) da diversi politici . Che spesso correggono il tiro, ma quasi mai pagano. In occasione della Giornata internazionale per l’eliminazione della discriminazione","naufragio del 19 aprile 2015 nel Canale di Sicilia (in cui hanno perso la vita quasi mille migranti ), sono stati pubblicati commenti razzisti per nulla anonimi. Spesso, infatti, chi scrive non percepisce come illeciti i contenuti che pubblica e, quindi, non nasconde la propria identità . Sotto il profilo legislativo la legge Mancino (pur prevedendo pene più severe rispetto alla legge 85 del 2006) è antecedente alla diffusione dell’uso di internet e prevede solo quattro reati punibili (quelli discriminatori basati sull’etnia, la nazionalità, la religione e le minoranze linguistiche). Il risultato? Non tutta la propaganda razzista è sanzionabile penalmente.",Positive,0.7319,Yes,", the article discusses racial hate speech specifically mentioning the derogatory term used against Kyenge which is a clear example of hate speech,",Yes,", the author's motivation is to raise awareness about the prevalence of racism and discrimination in society",il_fatto_quotidiano,Italy
Razzismo le storie Il Fatto Quotidiano.html,"Razzismo, le storie di discriminazione quotidiana di Ester, Sana, Cynthia. “Cos’è cambiato? Ora è praticato da istituzioni”","“Se è capitato a mio figlio che una persona si alzasse o non volesse sedersi accanto a lui sul treno o sull’autobus? Ma certo, guardi che questa cosa gli succede spessissimo: le persone si spostano, oppure stringono la borsa più forte. Pensi che una volta gli hanno rifiutato un posto come commis di sala in un albergo, nonostante avesse studiato tre anni per farlo, perché non volevano persone di colore. Eppure siamo brasiliani ”. Ester vive in Italia da sempre, a Prato , è sposata, lavora e parla un italiano fluente, con un leggero accento. Spiega che gli episodi di razzismo non hanno smesso di accadere neanche a lei. In particolare, racconta, il fatto “di non essere servita nei negozi ”. “Puoi aspettare anche tantissimo, fanno finta di non vederti. L’ultima volta mi è successo in un bar, ho protestato come sempre, ma la signora alla cassa mi ha ignorato. Una volta non mi hanno fatto entrare in una gioielleria , nonostante io suonassi il campanello. Ma la cosa più grottesca mi è capitata quando la badante moldava di mio suocero è stata aggredita: il poliziotto a cui cercavo di spiegare l’accaduto a un certo punto si è voltato e ha detto a un’altra persona: ‘Mi spieghi lei che è italiano che con questa non capisco nulla’”. A parlare con chi in Italia vive e lavora da anni (o decenni) si capisce che il razzismo da noi non è un fatto eccezionale. Anzi, i “nuovi italiani” non si stupiscono neanche troppo a leggere gli ultimi episodi: come quello dell’uomo che su un volo Ryanair uomo si è rifiutato di stare seduto nel sedile accanto a una donna nera e ha preteso che le hostess la spostassero altrove . O della signora che su un Frecciarossa Milano-Trieste si è rivolta a una ragazza dicendo di non volersi sedere vicino a una “negra” , o del giovane senegalese insultato su un autobus Flixbus . Tutti concordano, però, sul fatto che ci sia un aumento di violenza, come testimoniano alcuni episodi: i due extracomunitari picchiati con mazze da baseball a Brindisi , o il giovane senegalese aggredito e finito in ospedale mentre stava andando al lavoro in un panificio di Morbegno . “Il problema”, spiega Margherita , bolognese, tre figli, sposata con Alvin , nato alle Seychelles ma bolognese come lei, “è che oggi i razzisti si sentono legittimati, avvalorati in ciò che dicono, spalleggiati, mentre prima non era così”. “Mio marito Alvin è arrivato qui in terza elementare, parla in dialetto bolognese, viene da una famiglia cattolica, ha fatto persino il chierichetto. Abbiamo due ottimi lavori, siamo benestanti, super integrati . Eppure, pensi un po’, l’altro giorno l’ho trovato che mandava il curriculum senza foto, per la paura di essere scartato . Insomma, puoi essere ricco e integrato quanto ti pare, ma se sei di colore devi essere bravo diecimila volte più degli altri per stare alla pari”. Margherita parla con in braccio l’ultima bambina di 18 mesi, poi ci sono due bambini di otto e nove anni, “battezzati e comunicati”. E proprio di uno di loro, racconta, è stato vittima di insulti . “’Vai a fare la religione del paese tuo, tua madre puzza, tuo padre viveva nelle capanne’ gli hanno detto. Lui ha cominciato a regredire , somatizzare, faceva la pipì nel letto, alla fine gli ho dovuto cambiare scuola ”. Però la cosa più fastidiosa, dice, sono gli episodi di razzismo striscianti. “Vogliamo parlare della vicina che ti citofona dopo che hai appena partorito per chiederti di che colore è il bambino e dopo che l’ha vista dice ‘carina per essere negretta’? Oppure di quelli che ti dicono che le fidanzate dei tuoi figli maschi saranno fortunate, alludendo al fatto che quelli di colore avrebbero il pene più lungo? O, da ultimo, quest’estate al mare, di una signora che, dopo aver chiesto ai miei figli da dove provenissero, si è accanita su mio marito arrivando a chiedergli se avesse i documenti a posto?”. Il passaggio dallo sguardo allo spintone – “Il razzismo c’è sempre stato, ma oggi le persone hanno il coraggio di comportarsi da razzisti perché credono di essere nella parte giusta, e iniziano a esagerare, dallo sguardo passano allo sputo e allo spintone”. Sana , di origini giordane, ha due ragazzi, vive a Roma da oltre vent’anni. Suo marito lavora e i suoi figli sono tutti nati e andati a scuola in Italia , pur avendo un nome arabo. “Quando sono arrivata qui mi sembrava tutto bellissimo – racconta – ma solo perché non capivo la lingua . Poi ho cominciato a realizzare, a sentire i commenti sull’ autobus o quando andavo dalla pediatra . Allora portavo il velo , ma a un certo punto ho deciso di toglierlo: è successo dopo che ho subito un’aggressione vicino a un parco. Era d’estate, ero sola coi bambini . Tre ragazzi mi hanno circondato e dato calci, prendendomi in giro, ‘ Sei la sorella di Bin Laden ’. Da allora ho smesso persino di sedermi sull’autobus, preferisco stare in piedi”. Ma anche per Sana il peggio è successo al suo secondo figlio. “È stato vittima di commenti e minacce , ‘siete venuti coi barconi , abbiamo bruciato un barbone e ora facciamo la stessa cosa con te’, cose orribili. L’ho detto alle maestre, ma nulla, poi alla direttrice , nulla, alla fine sono andata dai carabinieri a fare denuncia”. Se poi non sei ‘mezzo bianco’ ma nero e basta, allora i pregiudizi si fanno ancora più consistenti. “Proprio di recente volevo sedermi sul treno per andare a casa, una signora mi ha detto che il sedile accanto a lei era occupato, ma poi l’ha ceduto subito a un altro. Per noi è un continuo di episodi così”. A parlare è Cynthia , 48 anni, di origini nigeriane, in Italia da oltre vent’anni. Gestisce con una parente, un negozio di parrucchiere in una zona centrale di una città d’arte. “Lei non si immagina quanti clienti arrivano e mi chiedono dove sia la padrona, non riescono a pensare il negozio possa essere nostro, o di quanti uomini entrano convinti che facciamo ‘massaggi’. Nel nostro condominio siamo le uniche straniere e solo due persone su sette ci salutano, le altre mai. Nel Duemila non era così, le cose sono peggiorate. Adesso noi abbiamo paura degli italiani e loro hanno paura di noi. È assurdo”. Quando il razzismo diventa istituzionale – L’Italia è diventata davvero più razzista? E quanto contano le parole delle istituzioni su immigrati e clandestini ? “Episodi di razzismo di questo genere si verificano da quando esiste l’ immigrazione – spiega Annamaria Rivera , già docente di Etnologia e antropologia sociale all’ Università di Bari e attivista antirazzista -. Ma da quando si è insediato questo governo ne sentiamo sempre più spesso. È vero che alcuni media sono più attenti, ma il fatto è che quando il razzismo viene legittimato o addirittura praticato dalle istituzioni aumenta, in un circolo vizioso , il razzismo detto ‘spontaneo’ o ‘popolare’. Si chiama ‘socializzazione del rancore’”. Concorda sul peso delle dichiarazioni dei politici anche il sociologo Pietro Basso , per molti anni direttore del Master sull’immigrazione all’ Università Ca’ Foscari , e autore del libro Razzismo di Stato. Stati Uniti, Europa, Italia (Franco Angeli editore). “Non ci sono dubbi. Se il ministro dell’Interno, da cui dipende la polizia, dedica la quasi totalità dei messaggi a criminalizzare gli immigrati questo conta, altro che se conta! Il razzismo è anzitutto un prodotto istituzionale ”. “La violenza privata che si esprime nel razzismo quotidiano deriva dalla maniera in cui lo Stato si comporta. È evidente che i discorsi di Salvini incoraggino le persone ad essere razziste”, osserva lo scrittore e poeta marocchino Tahar Ben Jelloun , noto per i suoi scritti su immigrazione e razzismo e autore del libro La punizione e Il razzismo spiegato a mia figlia (La Nave di Teseo). Ma il parallelismo con il fascismo è legittimo o esagerato? Risponde ancora Rivera : “La situazione è molto allarmante. Presenta qualche analogia con gli ultimi anni della Repubblica di Weimar , quelli che precedettero il nazismo. Il razzismo di Salvini è anch’esso quotidiano ed è costituito non solo da parole, ma anche da fatti assai concreti: dalla guerra contro le ong al decreto-legge Sicurezza e immigrazione , fino all’annuncio di chiusura anticipata dei cosiddetti negozietti etnici e solo di questi: cosa, quest’ultima, che ricorda la chiusura forzosa degli esercizi commerciali ‘ebraici’, praticata da regimi totalitari ”. Basso spiega tuttavia cosa si può fare per arginare la deriva e chi dovrebbe intervenire. “I luoghi di lavoro e le scuole sono i luoghi decisivi. Bisogna riprendere la lotta , perché unisce i lavoratori , spazza via questo timore, accomuna, lega, ripulisce i cervelli e gli animi dai veleni. Certo anche gli intellettuali e gli artisti possono dare un contributo a bloccare e rovesciare la tendenza in atto, ma solo a condizione di andare in profondità , alle cause strutturali del razzismo , perché per vincere questa battaglia non bastano i buoni sentimenti . Ci vuole una critica affilata del razzismo del mercato, dello stato, dei media e solidarietà con tutte le forme di contestazione per arginarlo”. Dice invece Tahar Ben Jelloun : “Invertire la tendenza spetterebbe ai partiti di sinistra, se non avessero purtroppo fallito. Se Salvini ha potere, infatti, la colpa è soprattutto loro. Bisognerebbe che gli italiani manifestassero nettamente il loro rifiuto verso questa politica che non risolve alcun problema, al contrario li crea. Ma anche l’ Europa dovrebbe riflettere perché è stata la sua mancanza di solidarietà nel momento in cui gli immigrati sbarcano sulle vostre coste a spingere molte persone a votare Lega ”.","“Se è capitato a mio figlio che una persona si alzasse o non volesse sedersi accanto a lui sul treno o sull’autobus? Ma certo, guardi che questa cosa gli succede spessissimo: le persone si spostano, oppure stringono la borsa più forte. Pensi che una volta gli hanno rifiutato un posto come commis di sala in un albergo, nonostante avesse studiato tre anni per farlo, perché non volevano persone di colore. Eppure siamo brasiliani ”. Ester vive in Italia da sempre, a Prato , è sposata, lavora e parla un italiano fluente, con un leggero accento. Spiega che gli episodi di","del razzismo del mercato, dello stato, dei media e solidarietà con tutte le forme di contestazione per arginarlo”. Dice invece Tahar Ben Jelloun : “Invertire la tendenza spetterebbe ai partiti di sinistra, se non avessero purtroppo fallito. Se Salvini ha potere, infatti, la colpa è soprattutto loro. Bisognerebbe che gli italiani manifestassero nettamente il loro rifiuto verso questa politica che non risolve alcun problema, al contrario li crea. Ma anche l’ Europa dovrebbe riflettere perché è stata la sua mancanza di solidarietà nel momento in cui gli immigrati sbarcano sulle vostre coste a spingere molte persone a votare Lega ”.",Positive,0.9768,Yes,", the article contains multiple instances of racial hate speech against Black people including explicit references to discriminatory behaviors and derogatory terms used against individuals of African descent",Yes,", the author's motivation is to highlight and condemn racism and discrimination which indicates a stance against racist ideologies",il_fatto_quotidiano,Italy
Razzismo Mehdi Dorval.html,"Razzismo, Mehdi Dorval esce dal campo in lacrime dopo Bari-Cremonese. L’allenatore Longo: “Vazquez lo ha chiamato n***o di m”","Ci sono gioie importanti che Mehdi Dorval a Bari sta vivendo: nelle ultime ore del calciomercato, il difensore è stato a un passo dal trasferimento al Napoli (passaggio ‘in famiglia’ essendo entrambe le società di proprietà De Laurentiis ), a dimostrazione del campionato di alto livello del classe 2001 . Ma poi ci sono terribili dolori, che cancellano tutto il resto. “È stato chiamato ancora una volta negro di merda ”. Così, crudo. A dirlo è Moreno Longo , allenatore del Bari , nella zona mista dopo la partita giocata in casa contro la Cremonese . Il risultato finale è stato di 1-1 con un autogol dei lombardi allo scadere: il finale chiaramente concitato (ce lo si poteva aspettare) ha però avuto delle pieghe su cui ora potrebbe aprire un fascicolo la Procura Federale . Accade tutto, appunto, negli ultimi minuti: Vazquez , attaccante della Cremonese, avrebbe rivolto insulti discriminatori verso l’avversario, uscito dal campo in lacrime . A confermare il fatto non è stato soltanto il suo allenatore , ma anche il compagno di squadra Benali : “A fine partita stava piangendo, queste cose non sono concepibili”. Sempre Longo in conferenza stampa ha voluto spiegare in maniera più chiara l’episodio: “A fine gara c’è stata questa offesa ricevuta da parte di Vazquez . Nel 2025 il razzismo non si può accettare, bisogna evitare certi atteggiamenti e queste cose vanno sottolineate. Siamo tutti vicini al ragazzo perché non è la prima volta che questi episodi lo riguardano”. Il riferimento va allo scorso 12 gennaio, quando durante Reggiana-Bari la partita era stata sospesa per 7’ sul finire del primo tempo, per insulti razzisti rivolti proprio verso Dorval . La replica della Cremonese Vazquez, che era stato sostituito nell’intervallo ed era rimasto in panchina , non ha rilasciato commenti. Mentre dell’episodio, ma senza entrare troppo nel dettaglio, ha parlato l’allenatore Stroppa : “Solitamente vado subito negli spogliatoi per salutare l’allenatore dell’altra squadra e l’arbitro. Quindi non ero in campo” ha detto. “Mi è stato riferito di una fase concitata: spero non si sia trattato di qualcosa di grave , nel caso sarei il primo a esserne dispiaciuto . Soprattutto se fosse coinvolto un ragazzo che è molto diverso da così”. Si aspetta quindi una presa di posizione da parte della Procura Federale, che dovrà stabilire se aprire un fascicolo e quindi prendere i provvedimenti del caso. Se dovesse essere tutto confermato, Vazquez potrebbe rischiare una squalifica di “almeno 10 giornate ” (così recita il regolamento della Figc), mentre la Cremonese in una sanzione pecuiniaria.","Ci sono gioie importanti che Mehdi Dorval a Bari sta vivendo: nelle ultime ore del calciomercato, il difensore è stato a un passo dal trasferimento al Napoli (passaggio ‘in famiglia’ essendo entrambe le società di proprietà De Laurentiis ), a dimostrazione del campionato di alto livello del classe 2001 . Ma poi ci sono terribili dolori, che cancellano tutto il resto. “È stato chiamato ancora una volta negro di merda ”. Così, crudo. A dirlo è Moreno Longo , allenatore del Bari , nella zona mista dopo la partita giocata in casa contro la Cremonese . Il risultato finale è","Quindi non ero in campo” ha detto. “Mi è stato riferito di una fase concitata: spero non si sia trattato di qualcosa di grave , nel caso sarei il primo a esserne dispiaciuto . Soprattutto se fosse coinvolto un ragazzo che è molto diverso da così”. Si aspetta quindi una presa di posizione da parte della Procura Federale, che dovrà stabilire se aprire un fascicolo e quindi prendere i provvedimenti del caso. Se dovesse essere tutto confermato, Vazquez potrebbe rischiare una squalifica di “almeno 10 giornate ” (così recita il regolamento della Figc), mentre la Cremonese in una sanzione pecuiniaria.",Positive,0.875,Yes,", the article contains a direct quote of a racial slur directed at a Black player which qualifies as hate speech,",Yes,", the author's motivation appears to be highlighting and condemning racism in sports and advocating for awareness against such behavior",il_fatto_quotidiano,Italy
