File Name,Title,Text,First Words,Last Words,Sentiment,Sentiment Score,Racial_Hate_Speech,Explanation_Hate_Speech,Motivation_Author,Explanation_Motivation,newspaper,Country
Fiorentina_ Kean bersaglio di insulti razzisti sui social - Calcio - Ansa.it.html,Fiorentina: Kean bersaglio di insulti razzisti sui social,"Moise Kean bersaglio di insulti
razzisti sui social. E' stato lo stesso attaccante della
Fiorentina a denunciarlo postando alcuni screen contenenti
commenti altamente offensivi, in cui viene spesso definito
'scimmia', ricevuti sul proprio profilo Instagram al termine
della partita persa ieri sera dalla squadra viola a Milano
contro l'Inter. Andando a scorrerli ci sono pure nomi e cognomi
di chi ha pubblicato tali nefandezze. Kean ha risposto postando a sua volta, sotto forma di storia,
tante faccine che vomitano e il commento ''Ancora, nel
2025...''. Mentre la Fiorentina si è schierata subito in difesa
del proprio giocatore pubblicando su X un duro comunicato: ''La
società viola e tutto il club esprimono la propria vicinanza a
Moise Kean, vittima sui social media, al termine della partita
disputata contro l'Inter a Milano, di pesanti attacchi a sfondo
razzista. Gli autori di tali gesti sono stati segnalati alle
autorità competenti''. Riproduzione riservata © Copyright ANSA","Moise Kean bersaglio di insulti razzisti sui social. E' stato lo stesso attaccante della Fiorentina a denunciarlo postando alcuni screen contenenti commenti altamente offensivi, in cui viene spesso definito 'scimmia', ricevuti sul proprio profilo Instagram al termine della partita persa ieri sera dalla squadra viola a Milano contro l'Inter. Andando a scorrerli ci sono pure nomi e cognomi di chi ha pubblicato tali nefandezze. Kean ha risposto postando a sua volta, sotto forma di storia, tante faccine che vomitano e il commento ''Ancora, nel 2025...''. Mentre la Fiorentina si è schierata subito in difesa del proprio giocatore pubblicando su X","ci sono pure nomi e cognomi di chi ha pubblicato tali nefandezze. Kean ha risposto postando a sua volta, sotto forma di storia, tante faccine che vomitano e il commento ''Ancora, nel 2025...''. Mentre la Fiorentina si è schierata subito in difesa del proprio giocatore pubblicando su X un duro comunicato: ''La società viola e tutto il club esprimono la propria vicinanza a Moise Kean, vittima sui social media, al termine della partita disputata contro l'Inter a Milano, di pesanti attacchi a sfondo razzista. Gli autori di tali gesti sono stati segnalati alle autorità competenti''. Riproduzione riservata © Copyright ANSA",Positive,0.5859,Yes,", the article describes racist insults directed at Moise Kean including the term scimmia which is a derogatory term used against Black people,",Yes,", the author highlights the racism faced by Kean indicating an awareness of and response to racial discrimination",ansa,Italy
"Manifesti a Torino, 'Migranti tornate a casa vostra' - Nazioni - Ansa.it.html","Manifesti a Torino, 'Migranti tornate a casa vostra'","TORINO - La Digos della Questura di Torino sta indagando su alcuni manifesti apparsi fuori dal centro di accoglienza di via Traves, dove sono ospitati stranieri provenienti da Lampedusa. I manifesti, scritti in lingua inglese, francese e araba invitano i migranti ""a tornare al proprio Paese"". ""Non possiamo aiutarvi. Tornate nella vostra terra a contribuire al suo sviluppo materiale per poter vivere in pace e dignità. Combattete per il vostro diritto a non dover emigrare"", si legge. I manifesti sono firmati da un gruppo di estrema destra, 'La Barriera', sigla apparsa da alcuni mesi in città e che avrebbe preso il testimone di sigle d'area disciolte. L'azione viene spiegata in un comunicato: ""Abbiamo voluto affiggere questi manifesti per spiegare agli immigrati appena arrivati nella nostra nazione che, a differenza di quanto gli facciano credere scafisti, ong e tutti coloro che guadagnano grazie all'immigrazione clandestina, in Italia e in Europa non possiamo aiutarli, perché le risorse, insufficienti, che abbiamo vanno destinate all'aiuto dei moltissimi italiani che versano in condizioni economiche disastrose"". Riproduzione riservata © Copyright ANSA","TORINO - La Digos della Questura di Torino sta indagando su alcuni manifesti apparsi fuori dal centro di accoglienza di via Traves, dove sono ospitati stranieri provenienti da Lampedusa. I manifesti, scritti in lingua inglese, francese e araba invitano i migranti ""a tornare al proprio Paese"". ""Non possiamo aiutarvi. Tornate nella vostra terra a contribuire al suo sviluppo materiale per poter vivere in pace e dignità. Combattete per il vostro diritto a non dover emigrare"", si legge. I manifesti sono firmati da un gruppo di estrema destra, 'La Barriera', sigla apparsa da alcuni mesi in città e che avrebbe preso","si legge. I manifesti sono firmati da un gruppo di estrema destra, 'La Barriera', sigla apparsa da alcuni mesi in città e che avrebbe preso il testimone di sigle d'area disciolte. L'azione viene spiegata in un comunicato: ""Abbiamo voluto affiggere questi manifesti per spiegare agli immigrati appena arrivati nella nostra nazione che, a differenza di quanto gli facciano credere scafisti, ong e tutti coloro che guadagnano grazie all'immigrazione clandestina, in Italia e in Europa non possiamo aiutarli, perché le risorse, insufficienti, che abbiamo vanno destinate all'aiuto dei moltissimi italiani che versano in condizioni economiche disastrose"". Riproduzione riservata © Copyright ANSA",Neutral,0.0,Yes,", the article contains manifestos that explicitly tell migrants to return to their countries which can be seen as a form of racial hate speech against people of African descent,",Yes,", the motivation of the author appears to be driven by a desire to exclude and diminish the rights of migrants which aligns with racist ideologies",ansa,Italy
"Caccia al nero, 11 casi in 50 giorni. Salvini non può liquidare il razzismo con una battuta di quarta categoria - Il Fatto Quotidiano.html","Caccia al nero, 11 casi in 50 giorni. Salvini non può liquidare il razzismo con una battuta di quarta categoria","In un momento in cui viene sottovalutata l’ondata di violenza razzista, licenziata dal ministro Salvini con una battuta di quarta categoria . Proprio oggi, in occasione della Giornata mondiale contro la tratta di esseri umani , è venuto il momento di diffondere e difendere la verità contro chi semina odio e crea Fake News ad arte per giustificare e fomentare questa violenza razzista e xenofoba. Che trova origine solo dalle bugie come quella su Josefa , inventate e condivise dai professionisti dell’odio. Undici casi in 50 giorni, e ho voluto citare solo i più eclatanti, senza contare le decine di violenze subite in silenzio da uomini, donne e bambini e mai denunciate. E chi è il mandante di tutto questo? Probabilmente lo stesso ministro che tenta di minimizzare. E per il quale sarà il caso di organizzare una mobilitazione nazionale quanto prima possibile. Intanto diffondiamo quanto più possibile questo elenco dei casi di razzismo e violenza inventati dalla “sinistra”: 1. Caserta, 11 giugno Daby e Sekou , due ragazzi del Mali sono ospiti di una struttura Sprar del Comune. Quella sera, tardi, senza nessun motivo vengono investiti da una raffica di colpi di pistola ad aria compressa sparati da una Panda nera. Daby viene ferito all’addome. In questura racconta che i tre aggressori inneggiavano a Matteo Salvini . 2. Napoli, 20 giugno Konate Bouyagui , è uno chef del Mali di 22 anni, da quattro in Italia con regolare permesso di soggiorno, viene colpito alla pancia da un piombino mentre torna a casa. A sparare due ragazzi a bordo di una macchina. Dopo l’aggressione, il giovane chef dichiara: “Questi episodi sono collegati alla campagna elettorale del governo. Uno che ti spara con un proiettile finto può anche decidere poi di usarne uno vero e ti uccide… Salvini smetta di lanciare messaggi d’odio”. 3. Forlì, 2 luglio Una giovane donna nigeriana , sposata con un italiano, viene ferita a un piede da un colpo sparato da una pistola ad aria compressa da due giovani in scooter. 4. Forlì, 5 luglio Un ivoriano di 33 anni viene colpito alla pancia con una pistola da softair mentre si muove in bicicletta. 5. Latina, 12 luglio Due nigeriani di 26 e 19 anni che aspettano l’autobus a Latina Scalo, vengono colpiti con vari colpi esplosi da una pistola ad aria compressa, responsabili due individui a bordo di un’auto scura. Solidarietà da parte del sindaco Damiano Coletta “Sembra chiara la matrice discriminatoria”, commenta. 6. Roma, 17 luglio Una bambina di etnia rom di 13 mesi in braccio alla madre viene colpita alla schiena da un piombino mentre si trova per strada. Ricoverata all’ospedale Bambin Gesù , le sue condizioni restano gravi per il rischio di danni alla colonna vertebrale . Chi ha sparato è un ex dipendente del Senato che, dice,  “volevo provare l’arma”. Spara dal suo terrazzo al settimo piano di una palazzina in zona Cinecittà. Il pistolero dirà di non aver mirato a nessuno in particolare, e di non essersi accorto che il colpo era andato a segno. 7. Vicenza, 26 luglio Un operaio 33enne di origine capoverdiana, dipendente di una ditta di impianti elettrici , viene colpito alla schiena mentre è al lavoro su una pedana mobile a 7 metri di altezza. A sparare è stato un 40enne del luogo, individuato dai carabinieri che sono risaliti al punto dello sparo. L’uomo spiega ai carabinieri di aver sbagliato mira mentre tentava di prendere un piccione. 8. Palermo, 28 luglio Un 19enne senegalese richiedente asilo , che lavora come cameriere in un bar di piazza Caterina, a Partinico (Pa) , è stato aggredito da un gruppo di ragazzi che gli hanno procurato ferite al labbro e alle orecchie. Gli assalitori avrebbero gridato vari insulti razzisti, invitandolo a “tornare a casa tua”. Per l’arcivescovo di Monreale, monsignor Michele Pennisi : è “un atto razzista e xenofobo” . 9. Aprilia, 29 luglio Lo credono un ladro: immigrato inseguito e pestato a morte . Un 43enne marocchino è morto la notte scorsa ad Aprilia (Latina) dopo un inseguimento in auto, andata a sbattere contro un muretto. La caccia a un uomo, presunto ladro, è sfuggita di mano la notte scorsa ad Aprilia , nel nord della provincia di Latina, e i giustizieri della porta accanto si sono all’improvviso trasformati in assassini. Ne sembrano convinti i carabinieri, che dopo alcune indagini hanno denunciato due uomini di 40 anni, del posto, ipotizzando l’omicidio preterintenzionale. 10. Catania 29 luglio Quattro persone immigrate lasciate a terra dal bus per Taormina . Non basta avere acquistato il biglietto per salire sul pullman. Questo hanno pensato le quattro persone di origine africana che stamattina sarebbero volute andare da Catania a Taormina e invece sono rimaste alla stazione Interbus di Catania. “Stavo per prendere l’autobus per Marzamemi – racconta Franca Scardilli – quando ho assistito a questa scena. L’autista ha chiuso le bussole e se n’è andato lasciando a terra quel gruppo di persone. E’ intervenuto un impiegato della stessa azienda che ha cercato di calmare quelle persone, persone tra l’altro che parlano perfettamente l’italiano. Hanno detto che vogliono sporgere denuncia e io naturalmente sono pronta a testimoniare”. 11. Moncalieri, 30 luglio L’ultima in ordine di tempo – ancora da verificare l’aggravante razziale – è l’aggressione subita da Daisy Osakue , atleta della nazionale di Atletica leggera, detentrice del record italiano under 23 di lancio del disco , nata a Torino da genitori nigeriani è stata ferita ieri a Moncalieri quando da un furgoncino di passaggio è iniziato un lancio di uova contro il gruppo delle sue amiche. Un episodio che potrebbe nascondere motivazioni razziste. La notizia è stata diffusa da Enrico Mentana sui social network con un post nel quale si vede il volto di Daisy in lacrime e con un occhio pesto. Daisy è stata colpita a un occhio ed ha riportato una lesione delle cornea che potrebbe compromettere la sua partecipazione ai prossimi europei. Una striscia di violenza e razzismo che quest’anno si è evoluta dal primo caso quello di Macerata, lo scorso 3 febbraio. Quando Luca Traini semina il terrore in città, sparando all’impazzata verso degli stranieri, ferendone sei. Traini, che nel 2017 fu candidato dalla Lega,rintracciato dalle Forze dell’ordine si fa trovare avvolto nel tricolore, facendo il saluto romano. Il 4 marzo è invece stato ucciso a Firenze il senegalese Idy Diene , preso da colpi di pistola su Ponte Vespucci da Roberto Pirrone , pensionato 65enne. Pirrone ha rivolto i colpi della sua arma contro il migrante che passava vicino a lui in quel momento. La sera del 2 giugno, infine, è stato ucciso Soumayla Sacko . L’omicidio è avvenuto tra Nicotera e Rosarno. La vittima era un attivista del sindacato Usb . Viveva nella tendopoli di San Fernando e aveva deciso di aiutare due connazionali a raccogliere in una fornace abbandonata alcune lamiere per le loro baracche quando è stato ammazzato con un colpo alla testa stava aiutando alcuni connazionali a prendere delle lamiere da una fabbrica in disuso. Soumayla nell’Italia che si è scoperta razzista è diventato un simbolo dei diritti dei lavoratori invisibili.","In un momento in cui viene sottovalutata l’ondata di violenza razzista, licenziata dal ministro Salvini con una battuta di quarta categoria . Proprio oggi, in occasione della Giornata mondiale contro la tratta di esseri umani , è venuto il momento di diffondere e difendere la verità contro chi semina odio e crea Fake News ad arte per giustificare e fomentare questa violenza razzista e xenofoba. Che trova origine solo dalle bugie come quella su Josefa , inventate e condivise dai professionisti dell’odio. Undici casi in 50 giorni, e ho voluto citare solo i più eclatanti, senza contare le decine di","migrante che passava vicino a lui in quel momento. La sera del 2 giugno, infine, è stato ucciso Soumayla Sacko . L’omicidio è avvenuto tra Nicotera e Rosarno. La vittima era un attivista del sindacato Usb . Viveva nella tendopoli di San Fernando e aveva deciso di aiutare due connazionali a raccogliere in una fornace abbandonata alcune lamiere per le loro baracche quando è stato ammazzato con un colpo alla testa stava aiutando alcuni connazionali a prendere delle lamiere da una fabbrica in disuso. Soumayla nell’Italia che si è scoperta razzista è diventato un simbolo dei diritti dei lavoratori invisibili.",Positive,0.296,Yes,", the article discusses multiple incidents of violence and discrimination against Black individuals and includes references to racist acts and motivations",Yes,", the author's motivation appears to advocate against racism and highlight the issues of violence and discrimination faced by People of African Descent",il_fatto_quotidiano,Italy
Il report sul razzismo delle forze dell'ordine arriva alla vigilia della causa per Hasib Omerovic - Il Fatto Quotidiano.html,Il report sul razzismo delle forze dell’ordine arriva alla vigilia della causa per Hasib Omerovic,"Il 22 ottobre la Commissione europea contro il razzismo e l’intolleranza (ECRI) ha pubblicato il suo periodico rapporto sull’Italia. I contenuti del testo – che riguardano, tra le altre cose, anche il razzismo e l’intolleranza da parte delle forze dell’ordine italiane – hanno suscitato l’immediata reazione, forte e colorita, da parte di esponenti politici e dello stesso primo ministro. Nel report dell’organismo del Consiglio d’Europa si legge come “ la delegazione dell’ECRI è venuta a conoscenza di molte testimonianze sulla profilazione razziale da parte delle forze dell’ordine in particolare verso la comunità rom e le persone di origine africana. Queste testimonianze di frequenti fermi e controlli basati sull’origine etnica sono confermate anche dai rapporti delle organizzazioni della società civile. Le autorità – denuncia l’ECRI – non raccolgono dati adeguatamente disaggregati sulle attività di fermo e di controllo della polizia, né sembrano essere consapevoli dell’entità del problema, e non considerano la profilazione razziale come una forma di potenziale razzismo istituzionale. La profilazione razziale ha effetti notevolmente negativi, in quanto genera un senso di umiliazione ed ingiustizia per i gruppi coinvolti provocando stigmatizzazione e alienazione”. Per questo, si conclude nel rapporto viene raccomandato “in via prioritaria, che le autorità commissionino prontamente uno studio completo e indipendente con l’obiettivo di individuare e affrontare qualsiasi pratica di profilazione razziale da parte delle forze dell’ordine che riguardi in particolare i rom e le persone di origine africana”. Immediata la risposta sui social della presidente del Consiglio Giorgia Meloni : “L’Ecri, organo del Consiglio d’Europa, accusa le forze di polizia italiane di razzismo? Le nostre Forze dell’Ordine sono composte da uomini e donne che, ogni giorno, lavorano con dedizione e abnegazione per garantire la sicurezza di tutti i cittadini, senza distinzioni. Meritano rispetto, non simili ingiurie”. Anche la replica di Matteo Salvini non si è fatta attendere sui social: “Donne e uomini in divisa attaccati vergognosamente dall’Ecri, un ente INUTILE pagato anche con le tasse dei cittadini italiani. Come Lega proporremo di risparmiare questi soldi per destinarli alla Sanità anziché infangare le nostre forze dell’Ordine. Se a questi signori piacciono tanto Rom e clandestini, se li portino tutti a casa loro a Strasburgo”. Tempistica perfetta per ricordare, sommessamente, che Presso il Tribunale di Roma è fissata per il prossimo 25 ottobre , l’udienza preliminare per i tre poliziotti coinvolti nel caso di Hasib Omerovic , il 37enne di origine rom precipitato dalla finestra nell’estate 2022 durante un’attività degli agenti del commissariato Primavalle nella sua abitazione . A seguito dell’inchiesta, coordinata dal pubblico ministero Stefano Luciani , sono indagati l’allora assistente capo della polizia presso il distretto XIV di Primavalle, Andrea Pellegrini, insieme ai suoi due colleghi Alessandro Sicuranza e Maria Rosa Natale. Secondo l’accusa, il primo, durante l’attività di identificazione in casa di Omerovic “con il compimento di plurime e gravi condotte di violenza e minaccia, cagionava al 36enne un verificabile trauma psichico , in virtù del quale lo stesso precipitava nel vuoto dopo aver scavalcato il davanzale della finestra della stanza da letto nel tentativo di darsi alla fuga per sottrarsi alle condotte violent e e minacciose in atto nei suoi confronti”. Pellegrini oltre che del reato di tortura, in concorso con i poliziotti Alessandro Sicuranza e Maria Rosa Natale, è accusato anche di falso aggravato. Nell’annotazione di servizio, infatti, i poliziotti avrebbero ricostruito, secondo l’accusa, in maniera inveritiera i motivi dell’intervento e, soprattutto, avrebbero omesso ”di indicare tutte le condotte poste in essere da Pellegrini all’interno dell’appartamento”. Chi vuole veramente prendere posizione a tutela del ruolo delle forze dell’ordine non dovrebbe farne una difesa “a prescindere ”. Gli atti di cui gli agenti del “caso Omerovic” sono indagati sono pericolosi tanto quanto la mancata presa di distanza dalle loro azioni, così come lo screditare le raccomandazioni di un ente indipendente come l’ECRI. Un simile propaganda politica è dannosa quanto la profilazione razziale riscontrata all’interno delle forze dell’ordine italiane. “È inoltre dannosa – e qui riprendo le parole dell’ECRI – per la sicurezza generale in quanto diminuisce la fiducia nella polizia e contribuisce a non denunciare reati”.","Il 22 ottobre la Commissione europea contro il razzismo e l’intolleranza (ECRI) ha pubblicato il suo periodico rapporto sull’Italia. I contenuti del testo – che riguardano, tra le altre cose, anche il razzismo e l’intolleranza da parte delle forze dell’ordine italiane – hanno suscitato l’immediata reazione, forte e colorita, da parte di esponenti politici e dello stesso primo ministro. Nel report dell’organismo del Consiglio d’Europa si legge come “ la delegazione dell’ECRI è venuta a conoscenza di molte testimonianze sulla profilazione razziale da parte delle forze dell’ordine in particolare verso la comunità rom e le persone di origine africana. Queste","dell’appartamento”. Chi vuole veramente prendere posizione a tutela del ruolo delle forze dell’ordine non dovrebbe farne una difesa “a prescindere ”. Gli atti di cui gli agenti del “caso Omerovic” sono indagati sono pericolosi tanto quanto la mancata presa di distanza dalle loro azioni, così come lo screditare le raccomandazioni di un ente indipendente come l’ECRI. Un simile propaganda politica è dannosa quanto la profilazione razziale riscontrata all’interno delle forze dell’ordine italiane. “È inoltre dannosa – e qui riprendo le parole dell’ECRI – per la sicurezza generale in quanto diminuisce la fiducia nella polizia e contribuisce a non denunciare reati”.",Negative,-0.5994,Yes,", the article discusses racial profiling and discrimination against people of African descent which qualifies as hate speech,",Yes,", the author's criticism of the political responses indicates a motivation to address systemic racism and protect marginalized communities",il_fatto_quotidiano,Italy
