File Name,Title,Text,First Words,Last Words,Sentiment,Sentiment Score,Racial_Hate_Speech,Explanation_Hate_Speech,Motivation_Author,Explanation_Motivation,newspaper,Country
Contro i clandestini serve il blocco navale - il Giornale.html,Contro i clandestini serve il blocco navale,"Sono 700mila, stando all'allarme lanciato dal Copasir, i migranti pronti a mettersi in viaggio dalle coste del Nord Africa per raggiungere l'Italia, unico Paese disposto ad accogliere chiunque senza protestare più di tanto. Un ruolo a cui il nostro Paese si è rassegnato e a cui esso, erroneamente, si ritiene votato a causa della sua posizione geografica, essendo collocato nel cuore del mare Mediterraneo e non troppo lontano dal continente africano. Settecentomila clandestini che si preparano ad assalirci in un lasso di tempo alquanto breve, giungendo a raffiche, costituiscono senza dubbio una minaccia alla sicurezza e all'ordine pubblico, in quanto si tratta di masse non controllabili di individui senza documenti che arrivano e pretendono assistenza, incidendo quindi notevolmente anche sulle casse dello Stato e sul nostro sistema di Welfare. Va da sé che, davanti a una situazione tanto preoccupante, è necessario ricorrere a misure di urgenza, addirittura eccezionali, in quanto il compito principale di un governo è la tutela del popolo e della Nazione, specifico: del suo di popolo. Questa attività non configura un abuso, un crimine, ma rientra nei doveri essenziali di un buon governo. L'esecutivo Meloni, da quando si è insediato, si è impegnato nel contrasto efficace al fenomeno della immigrazione illegale, conseguendo anche risultati notevoli, ovvero una diminuzione degli sbarchi e dunque pure dei morti in mare. Tuttavia, esso ha incontrato un ostacolo non da poco nell'attuazione di quei provvedimenti predisposti allo scopo di regolare una situazione fuori controllo, ereditata da lustri di politiche di accoglienza, scellerate e pericolosissime. Tale ostacolo è rappresentato da una magistratura, evidentemente politicizzata, che si diverte questa è l'impressione collettiva, non soltanto la mia a mettere i bastoni tra le ruote a Meloni poiché è Meloni. E questa è la ragione fondamentale per la quale il protocollo con l'Albania non ha incontrato piena attuazione. Cosa fare allora? È questa una domanda essenziale. Insomma, cosa fare davanti alla minaccia di uno tsunami di arrivi e a fronte di una magistratura che non collabora al bene del Paese costringendoci ad accogliere pure chi non ha diritto di asilo e di protezione umanitaria? Ebbene, io direi che è ora di rispolverare il cosiddetto «blocco navale», ovvero di tornare a quella idea originaria, reputata troppo forte e inattuabile, che abbiamo abbandonato, in quanto ci siamo forse fatti persuadere che sia irrealizzabile. Invece no. E vi spiego. Realizzare il blocco navale per respingere le migrazioni di massa irregolari per via marittima è alquanto complesso, in quanto la materia si interseca con la disciplina del mare territoriale e delle acque internazionali e con la tutela dei diritti umani, ma è fattibile. La soluzione sarebbe più semplice qualora le operazioni fossero condotte dalle organizzazioni internazionali (Ue e Onu), ma scarto a priori questa ipotesi, essendo allo stato poco realistica. Innanzitutto, cos'è il blocco navale? Il blocco navale è un'azione militare diretta a impedire l'entrata o l'uscita delle navi dai porti o dal territorio di uno Stato. Si tratta di un vero e proprio istituto giuridico, contemplato dal diritto bellico marittimo, ammesso (oltre che per legittima difesa) solo in occasione di conflitti armati. Le operazioni marittime di contrasto al trasporto illegale di migranti non rientrano nel concetto di blocco navale. Pertanto l'espressione va intesa in senso a-tecnico, per designare l'attività volta a impedire il passaggio di imbarcazioni cariche di extracomunitari che risultino univocamente dirette a raggiungere il territorio di un altro Stato, in violazione delle norme sull'immigrazione. Del resto, il traffico e trasporto illegale di migranti è punito gravemente dal T.U. immigrazione, in particolare nell'ipotesi di cui all'art. 12-bis, che prevede un reato universale (punibile, cioè, ovunque commesso). Ciò che interessa è stabilire quali siano i poteri dell'Italia (quale Paese di destinazione) di impedirlo, e quali siano gli obblighi degli Stati costieri dell'Africa (quali Paesi di provenienza) di non consentirlo. Ai sensi della Convenzione delle Nazioni Unite sul diritto del mare del 1982 (Unclos): «La sovranità dello Stato costiero si estende, al di là del suo territorio e delle sue acque interne a una fascia adiacente di mare, denominata mare territoriale». Inoltre, «Il passaggio nel mare territoriale è inoffensivo fintanto che non arreca pregiudizio alla pace, al buon ordine e alla sicurezza dello Stato costiero». Suddetta Convenzione specifica che «il passaggio di una nave straniera è considerato pregiudizievole per la pace, il buon ordine e la sicurezza dello Stato costiero se, nel mare territoriale, la nave è impegnata in una qualsiasi delle seguenti attività: il carico o lo scarico di materiali, valuta o persone in violazione delle leggi e dei regolamenti doganali, fiscali, sanitari o di immigrazione vigenti nello Stato costiero». Ai sensi dell'art. 25 della Convenzione: «Lo Stato costiero può adottare le misure necessarie per impedire nel suo mare territoriale ogni passaggio che non sia inoffensivo». Dunque, lo Stato costiero ha il potere di impedire il transito di una nave straniera che trasporti persone per favorirne l'ingresso nel suo territorio in violazione delle leggi nazionali sull'immigrazione e, a maggior ragione, di impedirne l'ingresso nei porti o nelle acque interne. Anche in alto mare lo Stato costiero ha taluni poteri. Le sue navi, ad esempio, sono autorizzate a esercitare il diritto di inseguimento in alto mare nei confronti di una nave che sia sospettata di agevolare l'immigrazione illegale. Il blocco può essere realizzato dallo Stato di destinazione o al confine con le proprie acque territoriali o all'interno delle acque territoriali dello Stato di provenienza o in alto mare. L'ipotesi più ragionevole è, a mio avviso, quella di un blocco operato in acque internazionali, ma in prossimità dello Stato di partenza: più il natante si trova a breve distanza dalla costa da cui è partito e meno è il tempo trascorso dalla partenza, maggiore sarà la probabilità che l'imbarcazione o i suoi passeggeri non versino in quello stato di pericolo che fa scattare l'obbligo di soccorso. Il governo italiano potrebbe decidere di adottare questa misura per contrastare la potenziale «minaccia umana» provocata dall'esodo di milioni di africani verso l'Europa e, in primo luogo, verso l'Italia. Il mancato contrasto ai movimenti migratori di massa ha portato in questi anni a un incremento di tale fenomeno, tanto da essere ormai da lustri incontrollabile e ingestibile. L'art. 42 della Carta Onu prevede che, in caso di minaccia alla pace, di una violazione della pace, o di un atto di aggressione «se il Consiglio di Sicurezza ritiene che le misure previste nell'articolo 41 siano inadeguate o si siano dimostrate inadeguate, esso può intraprendere, con forze aeree, navali o terrestri, ogni azione che sia necessaria per mantenere o ristabilire la pace e la sicurezza internazionale. Tale azione può comprendere dimostrazioni, blocchi ed altre operazioni mediante forze aeree, navali o terrestri di membri delle Nazioni Unite». L'art. 51 della Carta fa salvo, negli stessi casi, il diritto di autotutela individuale e collettiva dei singoli Stati. Le norme in questione non sono certamente applicabili all'immigrazione clandestina, ancorché gestita da organizzazioni criminali. Tuttavia nei casi in cui un'immigrazione di dimensioni tali da mettere a rischio le strutture sociali del Paese di arrivo sia deliberatamente consentita o addirittura incoraggiata dagli Stati di partenza, l'azione dello Stato di arrivo potrebbe essere inquadrata, in base a un'interpretazione estensiva del concetto, quale atto di aggressione o atto terroristico. In quest'ottica il blocco navale, ossia il respingimento, si sostanzierebbe in una forma pienamente legittima di difesa preventiva, secondo la dottrina Bush, nata dopo gli attentati dell'11 settembre.  Ho il sospetto che non ci resti altra soluzione. E presto ne prenderemo amara coscienza, purtroppo. ","Sono 700mila, stando all'allarme lanciato dal Copasir, i migranti pronti a mettersi in viaggio dalle coste del Nord Africa per raggiungere l'Italia, unico Paese disposto ad accogliere chiunque senza protestare più di tanto. Un ruolo a cui il nostro Paese si è rassegnato e a cui esso, erroneamente, si ritiene votato a causa della sua posizione geografica, essendo collocato nel cuore del mare Mediterraneo e non troppo lontano dal continente africano. Settecentomila clandestini che si preparano ad assalirci in un lasso di tempo alquanto breve, giungendo a raffiche, costituiscono senza dubbio una minaccia alla sicurezza e all'ordine pubblico, in quanto","gestita da organizzazioni criminali. Tuttavia nei casi in cui un'immigrazione di dimensioni tali da mettere a rischio le strutture sociali del Paese di arrivo sia deliberatamente consentita o addirittura incoraggiata dagli Stati di partenza, l'azione dello Stato di arrivo potrebbe essere inquadrata, in base a un'interpretazione estensiva del concetto, quale atto di aggressione o atto terroristico. In quest'ottica il blocco navale, ossia il respingimento, si sostanzierebbe in una forma pienamente legittima di difesa preventiva, secondo la dottrina Bush, nata dopo gli attentati dell'11 settembre. Ho il sospetto che non ci resti altra soluzione. E presto ne prenderemo amara coscienza, purtroppo.",Positive,0.8943,Yes,", the article contains language that dehumanizes and portrays migrants particularly from Africa as a threat to society and security which aligns with racial hate speech,",Yes,", the author's motivation is rooted in a racist perspective as it reflects a view that immigrants from Africa are a menace and should be blocked from entering the country",il_giornale,Italy
"Milano, Fn contro gli immigrati_ _Tornate a casa vostra_ - il Giornale.html","Milano, Fn contro gli immigrati: ""Tornate a casa vostra""",""" Questa notte i militanti di Forza Nuova Milano hanno effettuato una passeggiata della sicurezza nella zona di viale Stelvio, via Farini e piazzale Maciachini , affiggendo dei volantini in diverse lingue con la scritta ' Immigrati , tornate a casa vostra! In Italia siamo senza lavoro, senza casa,senza futuro '"". Inizia così il post su Facebook dei militanti di FN che ieri notte hanno camminato per le strade della città appendendo sui muri volantini scritti in diverse lingue. I cittadini dei quartieri interessati dall'iniziativa di FN hanno trovato, al loro risveglio, le strade tappezzate dai manifesti con la scritta anti immigrati ripertuta in italiano, francese, inglese, cinese e arabo ( guarda la gallery ). "" Da sempre una delle aree più pericolose di Milano per via della fortissima presenza di immigrati nordafricani , pochi giorni fa proprio viale Stelvio è stata teatro di una rissa tra immigrati conclusasi con il brutale accoltellamento di uno dei partecipanti "", si legge ancora sul social. "" Forza Nuova ribadisce con forza che l'attuale riduzione degli arrivi dal mar Mediterraneo non si sta accompagnando all'aumento dei rimpatri di tutti gli immigrati irregolari presenti sul suolo nazionale e che questa situazione sta alimentando degrado , insicurezza e caos in tutta Italia - continua il post di FN -.   ",""" Questa notte i militanti di Forza Nuova Milano hanno effettuato una passeggiata della sicurezza nella zona di viale Stelvio, via Farini e piazzale Maciachini , affiggendo dei volantini in diverse lingue con la scritta ' Immigrati , tornate a casa vostra! In Italia siamo senza lavoro, senza casa,senza futuro '"". Inizia così il post su Facebook dei militanti di FN che ieri notte hanno camminato per le strade della città appendendo sui muri volantini scritti in diverse lingue. I cittadini dei quartieri interessati dall'iniziativa di FN hanno trovato, al loro risveglio, le strade tappezzate dai manifesti con la scritta","). "" Da sempre una delle aree più pericolose di Milano per via della fortissima presenza di immigrati nordafricani , pochi giorni fa proprio viale Stelvio è stata teatro di una rissa tra immigrati conclusasi con il brutale accoltellamento di uno dei partecipanti "", si legge ancora sul social. "" Forza Nuova ribadisce con forza che l'attuale riduzione degli arrivi dal mar Mediterraneo non si sta accompagnando all'aumento dei rimpatri di tutti gli immigrati irregolari presenti sul suolo nazionale e che questa situazione sta alimentando degrado , insicurezza e caos in tutta Italia - continua il post di FN -.",Negative,-0.3802,Yes,", the article contains a clear call for immigrants to return to their home countries which targets specific groups of people including those of African descent",Yes,", the author's motivation is to promote a nationalist agenda that discriminates against immigrants and perpetuates fear and hatred towards them",il_giornale,Italy
_Tornate a casa vostra_. Quando la sinistra sputava sui profughi istriani - il Giornale.html,"""Tornate a casa vostra"". Quando la sinistra sputava sui profughi istriani","""Poi una mattina, mentre attraversavamo piazza Venezia per andare a mangiare alla mensa dei poveri, ci trovammo circondati da qualche centinaio di persone che manifestavano. Da un lato della strada un gruppo gridava: 'Fuori i fascisti da Trieste', 'Viva il comunismo e la libertà' sventolando bandiere rosse e innalzando striscioni che osannavano Stalin, Tito e Togliatti "". Stefano Zecchi,  nel suo romanzo sugli esuli istriani ( Quando ci batteva forte il cuore ), racconta così il benvenuto del Pci agli italiani che abbandonarono la Jugoslavia per trovare ostilità in Italia. Quella che fino a pochi attimi prima era la loro Patria. Quando alla fine della seconda guerra mondiale, il 10 febbraio 1947, l'Italia firmò il trattato di pace che consegnava le terre dell'Istria e della Dalmazia alla Jugoslavia di Tito, la sinistra non conobbe la parola 'accoglienza'. Tutt'altro. Si scaglio con rabbia e ferocia contro quei ""clandestini"" che avevano osato lasciare il paradiso comunista. Trecentocinquantamila profughi istriani e dalmati. Trecentocinquantamila italiani che la sinistra ha trattato come invasori, come traditori. Ad attenderli nei porti di Bari e Venezia c'erano sì i comunisti, ma per dedicargli insulti, fischi e sputi. A Bologna invece per evitare che il treno con gli esuli si fermasse, i ferrovieri minacciarono uno sciopero. E poi roversciarono il latte raccolto per le donne e i bambini affamati. Ecco . Bisogna dire che Giorgio Napolitano ha ragione: il Pd è l'erede del Pci. Ma oggi la sinistra italiana, che di quella storia è figlia legittima, dimentica gli orrori del febbraio del '47. Ora si cosparge il capo di cenere e chiede a gran voce che l'Italia apra le porte a tutti i migranti del mondo. Predica l'acccoglienza verso lo straniero che considera un fratello, quando per anni ha considerato stranieri i suoi fratelli. Ma gli unici profughi che la sinistra italiana ha rigettato con violenza erano italiani. Istriani e Dalmati. ""Sono comunisti. Gridano 'fascisti' a quella povera gente che scende dalla motonave (...). Urlano di ritornare da dove sono venuti"", ricorda Zecchi. Non sono le parole di Matteo Salvini . ""Tornate da dove siete venuti"" era lo slogan del Partito Comunista di Napolitano, Violante, D'Alema, Berlinguer e Veltroni. L'Unità , nell'edizione del 30 novembre 1946, scriveva: ""Ancora si parla di ' profughi' : altre le persone, altri i termini del dramma. Non riusciremo mai a considerare aventi diritto ad asilo coloro che si sono riversati nelle nostre grandi città. Non sotto la spinta del nemico incalzante, ma impauriti dall'alito di libertà che precedeva o coincideva con l'avanzata degli eserciti liberatori. I gerarchi, i briganti neri, i profittatori che hanno trovato rifugio nelle città e vi sperperano le ricchezze rapinate e forniscono reclute alla delinquenza comune, non meritano davvero la nostra solidarietà né hanno diritto a rubarci pane e spazio che sono già così scarsi"". Oggi invocano l'asilo per tutti. Si commuovono alla foto del bambino riverso sulla spiaggia. Lo pubblicano in prima pagina. Dedicano attenzione sempre e solo a chi viene da lontano.  ""Non dovevamo dimenticare che eravamo clandestini, anche se eravamo italiani in Italia "".","""Poi una mattina, mentre attraversavamo piazza Venezia per andare a mangiare alla mensa dei poveri, ci trovammo circondati da qualche centinaio di persone che manifestavano. Da un lato della strada un gruppo gridava: 'Fuori i fascisti da Trieste', 'Viva il comunismo e la libertà' sventolando bandiere rosse e innalzando striscioni che osannavano Stalin, Tito e Togliatti "". Stefano Zecchi, nel suo romanzo sugli esuli istriani ( Quando ci batteva forte il cuore ), racconta così il benvenuto del Pci agli italiani che abbandonarono la Jugoslavia per trovare ostilità in Italia. Quella che fino a pochi attimi prima era la loro","ma impauriti dall'alito di libertà che precedeva o coincideva con l'avanzata degli eserciti liberatori. I gerarchi, i briganti neri, i profittatori che hanno trovato rifugio nelle città e vi sperperano le ricchezze rapinate e forniscono reclute alla delinquenza comune, non meritano davvero la nostra solidarietà né hanno diritto a rubarci pane e spazio che sono già così scarsi"". Oggi invocano l'asilo per tutti. Si commuovono alla foto del bambino riverso sulla spiaggia. Lo pubblicano in prima pagina. Dedicano attenzione sempre e solo a chi viene da lontano. ""Non dovevamo dimenticare che eravamo clandestini, anche se eravamo italiani in Italia "".",Positive,0.7506,No,", the article does not contain explicit hate speech against People of African Descent as it primarily discusses historical events and sentiments towards Italian refugees and does not target Black people specifically,",No,", the author's motivation appears to be more about political critique than promoting a racist agenda towards any specific racial group",il_giornale,Italy
La logica razzista dietro il disegno di legge sulla sicurezza - Oiza Q. Obasuyi - Internazionale.html,La logica razzista dietro il disegno di legge sulla sicurezza,"Il disegno di legge sulla sicurezza approvato dalla camera e passato al senato è stato giustamente definito dall’associazione Antigone, da sempre attiva per i diritti delle persone in carcere, come “il più grande attacco alla libertà di protesta nella storia repubblicana”. Il testo, infatti, oltre a punire attivisti e attiviste che protestano pacificamente, criminalizza ulteriormente chi si trova già in strutture detentive o di trattenimento, dai centri di permanenza per il rimpatrio (Cpr) ai centri di accoglienza, alle prigioni. Non è un caso che nel mirino del testo ci siano le persone migranti, ormai da anni identificate come minaccia per la sicurezza nazionale. Questo modus operandi prende il nome di crimmigration , ossia un fenomeno in cui diritto penale e diritto dell’immigrazione si sovrappongono attraverso l’ inasprimento delle leggi. Il risultato è l’indebolimento, in alcuni casi perfino l’annientamento, dei diritti fondamentali degli stranieri. In Italia, dove l’immigrazione è spesso erroneamente analizzata e gestita in ottica unicamente emergenziale, è possibile osservare come i processi di precarizzazione e criminalizzazione degli stranieri derivino da una “produzione endogena di irregolarità”, come si legge in I migranti sui sentieri del diritto (Giappichelli 2021). Basti pensare al reato di immigrazione clandestina , com’è definito, secondo cui chi entra illegalmente in Italia “è punito con l’ammenda da 5mila a 10mila euro”. Nel testo emerge un lato punitivo che non tiene conto della povertà e della precarietà in cui si trovano spesso le persone arrivate nel paese; dell’ assenza di vie legali per arrivarci; e del fatto che chi non ha un permesso di soggiorno non può farsi assumere, né ha un conto in banca, quindi non può pagare alcuna ammenda, rendendo inutile la legge. Di conseguenza, non si punisce un fatto ma una condizione personale: è la persona migrante stessa che diventa reato, essendo definita come un pericolo sociale. Uno degli esempi più emblematici di crimmigration è la detenzione nei cpr. Ciò che da anni associazioni, giuristi e giuriste denunciano è la totale negazione dei diritti fondamentali delle persone rinchiuse, soprattutto alla luce della cattiva gestione dei centri, affidati a privati il cui unico scopo è massimizzare il profitto . In un contesto in cui sono continuamente denunciate condizioni inumane e degradanti – dalla somministrazione sistematica di psicofarmaci agli abusi da parte delle forze dell’ordine, fino ai tentativi di suicidio – l’articolo 27 del disegno di legge prevede fino a quattro o cinque anni di carcere contro chi si ribella all’interno di queste strutture, pena che può arrivare a venti anni “nel caso di lesioni gravi o gravissime o morte di più persone”. Il testo inquadra come atti di resistenza non solo le rivolte vere e proprie, ma perfino la resistenza passiva, che potrebbe essere interpretata in modo ampio dalle forze dell’ordine. Si pensi per esempio allo sciopero della fame o, come è già successo, all’atto di cucirsi la bocca con ago e filo. Il provvedimento si estende anche ai centri di accoglienza, dove si trovano le persone in attesa di chiedere asilo. È evidente la matrice puramente punitiva, di controllo e strutturalmente razzista di un provvedimento che punta ad annichilire le persone. Nei cpr, in particolare, dove gli stranieri sono spesso rinchiusi senza alcuna informazione sui propri diritti, mediazione linguistica e tutele, la resistenza – passiva e non – diventa di fatto l’unica modalità per essere ascoltati, insieme ad atti di autolesionismo, com’è evidenziato nei rapporti L’Affare cpr e Buchi Neri della Coalizione italiana libertà e diritti civili (Cild). Un altro esempio emblematico di resistenza passiva è quello di Maysoon Majidi, attivista curdo-iraniana, attualmente in sciopero della fame, che da nove mesi è ingiustamente rinchiusa nel carcere di Reggio Calabria poiché accusata di essere scafista. Ormai da tempo la criminalizzazione degli stranieri tocca – tra gravi errori giudiziari e accuse senza fondamento, come dimostra il rapporto Dal mare al carcere –  anche chi è identificato come chi durante la traversata era al timone della barca o semplicemente prestava soccorso ai compagni di viaggio. Proprio per quest’ultimo motivo, Majidi è considerata una criminale, benché sia fuggita dal regime iraniano in cerca di tutela. Infine, l’articolo 32 del testo sulla sicurezza impedisce alle persone prive di permesso di soggiorno di comprare una sim per il telefono. Questa misura, oltre che essere discriminatoria e in pieno contrasto con l’articolo 15 della costituzione, non è che l’ennesima discriminazione che porterà a un’ulteriore emarginazione degli stranieri, impedendogli di poter comunicare con gli altri, potenzialmente anche con gli avvocati e chi li aiuta nel complicato iter di ottenimento dello stesso permesso. Ancora una volta il governo si scaglia contro i diritti fondamentali delle persone straniere, facendo passare questo attacco per tutela della sicurezza nazionale. In realtà è l’ennesimo esempio di un sistema strutturalmente razzista, che non creerà altro che marginalità, senza di fatto agire a monte di quella “produzione endogena di irregolarità” sostenuta da leggi che in modo sistematico rendono precarie la condizione delle persone straniere in Italia.","Il disegno di legge sulla sicurezza approvato dalla camera e passato al senato è stato giustamente definito dall’associazione Antigone, da sempre attiva per i diritti delle persone in carcere, come “il più grande attacco alla libertà di protesta nella storia repubblicana”. Il testo, infatti, oltre a punire attivisti e attiviste che protestano pacificamente, criminalizza ulteriormente chi si trova già in strutture detentive o di trattenimento, dai centri di permanenza per il rimpatrio (Cpr) ai centri di accoglienza, alle prigioni. Non è un caso che nel mirino del testo ci siano le persone migranti, ormai da anni identificate come minaccia per","l’ennesima discriminazione che porterà a un’ulteriore emarginazione degli stranieri, impedendogli di poter comunicare con gli altri, potenzialmente anche con gli avvocati e chi li aiuta nel complicato iter di ottenimento dello stesso permesso. Ancora una volta il governo si scaglia contro i diritti fondamentali delle persone straniere, facendo passare questo attacco per tutela della sicurezza nazionale. In realtà è l’ennesimo esempio di un sistema strutturalmente razzista, che non creerà altro che marginalità, senza di fatto agire a monte di quella “produzione endogena di irregolarità” sostenuta da leggi che in modo sistematico rendono precarie la condizione delle persone straniere in Italia.",Positive,0.8316,No,", the article discusses discrimination against migrants without specific racial hate speech towards Black people,",No,", the author's motivation appears to be focused on advocating for migrant rights rather than expressing racist views",internazionale,Italy
